{
  "$schema": "../_schema/mode.schema.json",
  "id": "running",
  "label": "Running",
  "tagline": "Turn a run plan into a printable session card.",
  "shape": "timed",
  "dose": {
    "primary":   { "key": "duration", "label": "Time", "unit": "min" },
    "secondary": { "key": "distance", "label": "Distance", "unit": "km" }
  },
  "fields": {
    "primary":   { "key": "howto", "label": "How to run it" },
    "secondary": { "key": "watch", "label": "Watch for" }
  },
  "taxonomy": "patterns.json",
  "library":  "exercises.json",
  "figures":  "figures",
  "hero": "easy-run",
  "theme": { "accent": "#ff7b72", "soft": "#ff7b7222" }
}
