{
  "$schema": "../_schema/mode.schema.json",
  "id": "calisthenics",
  "label": "Calisthenics",
  "tagline": "Bodyweight progressions as a printable guide.",
  "shape": "reps",
  "dose": {
    "primary":   { "key": "sets", "label": "Sets" },
    "secondary": { "key": "reps", "label": "Reps" }
  },
  "fields": {
    "primary":   { "key": "form",     "label": "Form" },
    "secondary": { "key": "pitfalls", "label": "Avoid" }
  },
  "taxonomy": "patterns.json",
  "library":  "exercises.json",
  "figures":  "figures",
  "hero": "push-up",
  "theme": { "accent": "#4c8dff", "soft": "#4c8dff22" }
}
