{
  "$schema": "../_schema/mode.schema.json",
  "id": "mobility",
  "label": "Mobility",
  "tagline": "Joint prep and mobility drills as a printable warm-up.",
  "shape": "hold",
  "dose": {
    "primary":   { "key": "reps", "label": "Reps" },
    "secondary": { "key": "hold", "label": "Hold", "unit": "seconds" }
  },
  "fields": {
    "primary":   { "key": "cue",     "label": "How to" },
    "secondary": { "key": "easeoff", "label": "Keep it honest" }
  },
  "taxonomy": "patterns.json",
  "library":  "exercises.json",
  "figures":  "figures",
  "hero": "worlds-greatest-stretch",
  "theme": { "accent": "#e3a008", "soft": "#e3a00822" }
}
